### ISSUE TITLE
Harbor Nginx external connections

### ISSUE THREAD

**Issue by KingKunn** [goharbor/harbor#14801]
Hello!

We have some strange issue where Harbor nginx component is doing external connections from 8443 port towards our containerisation platform.

Is it possible to understand why and what functionality causes the connections?

**Our firewall logs shows that connection is started from 172.22.0.11, port 8443 to containerisation platform hosts:**
Time | source_host | source_port | destination_host | destination_port | direction | action
-- | -- | -- | -- | -- | -- | --
May 5, 2021 @ 10:04:05.175 | 172.22.0.11 | 8,443 | 100.XX.XX.XX | 35,648 | in | block
May 5, 2021 @ 10:04:05.464 | 172.22.0.11 | 8,443 | 100.XX.XX.XX | 35,664 | in | block
May 5, 2021 @ 10:04:05.464 | 172.22.0.11 | 8,443 | 100.XX.XX.XX | 35,664 | in | block
May 5, 2021 @ 10:05:07.110 | 172.22.0.11 | 8,443 | 100.XX.XX.XX | 58,512 | in | block

**Nginx container IP:**
```
[root@registry kunnar]# docker inspect -f '{{range.NetworkSettings.Networks}} {{.IPAddress}}{{end}}' nginx
 172.22.0.11 172.23.0.6
```

**Docker containers on the registry host:**
```
[root@registry kunnar]# docker ps -a
CONTAINER ID   IMAGE                                  COMMAND                  CREATED       STATUS                 PORTS                                                                 NAMES
6186f8829047   goharbor/harbor-jobservice:v2.2.0      "/harbor/entrypoint.…"   7 weeks ago   Up 4 weeks (healthy)                                                                         harbor-jobservice
6e203d281190   goharbor/nginx-photon:v2.2.0           "nginx -g 'daemon of…"   7 weeks ago   Up 4 weeks (healthy)   0.0.0.0:4443->4443/tcp, 0.0.0.0:80->8080/tcp, 0.0.0.0:443->8443/tcp   nginx
f40be8d763b9   goharbor/notary-server-photon:v2.2.0   "/bin/sh -c 'migrate…"   7 weeks ago   Up 4 weeks                                                                                   notary-server
ee6def62a728   goharbor/harbor-core:v2.2.0            "/harbor/entrypoint.…"   7 weeks ago   Up 4 weeks (healthy)                                                                         harbor-core
73ae706c14ed   goharbor/notary-signer-photon:v2.2.0   "/bin/sh -c 'migrate…"   7 weeks ago   Up 4 weeks                                                                                   notary-signer
915707a04689   goharbor/trivy-adapter-photon:v2.2.0   "/home/scanner/entry…"   7 weeks ago   Up 4 weeks (healthy)                                                                         trivy-adapter
cc3c23046d18   goharbor/harbor-db:v2.2.0              "/docker-entrypoint.…"   7 weeks ago   Up 4 weeks (healthy)                                                                         harbor-db
8772edacd877   goharbor/harbor-portal:v2.2.0          "nginx -g 'daemon of…"   7 weeks ago   Up 4 weeks (healthy)                                                                         harbor-portal
fca1ede58101   goharbor/redis-photon:v2.2.0           "redis-server /etc/r…"   7 weeks ago   Up 4 weeks (healthy)                                                                         redis
23145f6eacda   goharbor/registry-photon:v2.2.0        "/home/harbor/entryp…"   7 weeks ago   Up 4 weeks (healthy)                                                                         registry
45a8ae689d17   goharbor/harbor-registryctl:v2.2.0     "/home/harbor/start.…"   7 weeks ago   Up 4 weeks (healthy)                                                                         registryctl
f4bad4fb68ac   goharbor/harbor-log:v2.2.0             "/bin/sh -c /usr/loc…"   7 weeks ago   Up 4 weeks (healthy)   127.0.0.1:1514->10514/tcp                                             harbor-log
```

**TCPDump from the registry host:**
```
[root@registry kunnar]# tcpdump -nei eth0 port 8443
tcpdump: verbose output suppressed, use -v or -vv for full protocol decode
listening on eth0, link-type EN10MB (Ethernet), capture size 262144 bytes
10:04:05.176477 00:XX:XX:XX:XX:27 > 00:XX:XX:XX:XX:c8, ethertype IPv4 (0x0800), length 54: 172.22.0.11.pcsync-https > 100.XX.XX.XX.35648: Flags [R], seq 1367176924, win 0, length 0
10:04:05.465438 00:XX:XX:XX:XX:27 > 00:XX:XX:XX:XX:c8, ethertype IPv4 (0x0800), length 54: 172.22.0.11.pcsync-https > 100.XX.XX.XX.35664: Flags [R], seq 2221939197, win 0, length 0
10:04:05.465457 00:XX:XX:XX:XX:27 > 00:XX:XX:XX:XX:c8, ethertype IPv4 (0x0800), length 54: 172.22.0.11.pcsync-https > 100.XX.XX.XX.35664: Flags [R], seq 2221939197, win 0, length 0
```

**Nginx container netstat info:**
```
[root@registry kunnar]# docker exec -it nginx bash
nginx [ / ]$ netstat -tlnp
Active Internet connections (only servers)
Proto Recv-Q Send-Q Local Address           Foreign Address         State       PID/Program Name
tcp        0      0 127.0.0.11:34595        0.0.0.0:*               LISTEN      -
tcp        0      0 0.0.0.0:8080            0.0.0.0:*               LISTEN      1/nginx: master process nginx -g daemon off;
tcp        0      0 0.0.0.0:8443            0.0.0.0:*               LISTEN      1/nginx: master process nginx -g daemon off;
tcp        0      0 0.0.0.0:4443            0.0.0.0:*               LISTEN      1/nginx: master process nginx -g daemon off;
tcp        0      0 127.0.0.1:40816         127.0.0.1:8080          TIME_WAIT   -
tcp        0      0 127.0.0.1:40750         127.0.0.1:8080          TIME_WAIT   -
```

Thank you!

**Comment by ywk253100** [comment]
Is it possible that the requests are started by your containerisation platform? The connections in the firewall logs are just the response from the nginx?

**Comment by KingKunn** [comment]
Currently seems that it is somehow related to multiarch images which are created with manifest. Not always, but several times when pulling multiarch image from Harbor to my computer... at first my computer starts connection but later Harbor itself starts new connection to my computer. In new week will make better tests

**Comment by KingKunn** [comment]
HI!

I think that there is a code error in Harbor? As the bad connection query is with reset flag and is coming from Harbor Nginx Docker IP address instead of Harbor host network interface?

I could repeat the same thing with clean linux machine and blank Harbor instance:
* logged in several times (7-10x continuously) from client machine (docker login harbor-instance-vm-dns)
* The bad query is not appearing always, but got few of them from tcpdump
`1:43:01.085579 08:00:27:6b:68:61 > f4:5c:89:94:XX:XX, ethertype IPv4 (0x0800), length 54: 172.20.0.10.pcsync-https > 192.168.10.103.57379: Flags [R], seq 1654167612, win 0, length 0`

Is is expected behaviour or it is really a bug? ATM I don't feel that it affects something in prod env.

Thanks!
